{
  "schemaVersion": "1.0",
  "id": "gvm.light.sd300d",
  "name": "GVM SD300D",
  "version": "0.1.0",
  "kind": "PRODUCT",
  "description": "Knowledge module for GVM SD300D (SD Series Monolights)",
  "productIds": [
    "gvm.light.sd300d"
  ],
  "dependencies": [
    "gvm.brand-core"
  ],
  "languages": [
    "en",
    "fr"
  ]
}
