{
  "schemaVersion": "1.0",
  "id": "gvm.light",
  "name": "GVM 800D-II 40W Bi-color & RGB Video Panel Light",
  "version": "0.1.0",
  "kind": "PRODUCT",
  "description": "Knowledge module for GVM 800D-II 40W Bi-color & RGB Video Panel Light (800D Panel Series)",
  "productIds": [
    "gvm.light.sd300d",
    "gvm.light.800d"
  ],
  "dependencies": [
    "gvm.brand-core"
  ],
  "languages": [
    "en",
    "fr"
  ]
}